<?xml version="1.0" encoding="UTF-8"?>
<xs:schema xmlns:xs="http://www.w3.org/2001/XMLSchema"
	targetNamespace="http://www.uniovi.es"
	xmlns="http://www.uniovi.es"
	elementFormDefault="qualified">
	<xs:element name="circuitos">
		<xs:complexType>
			<xs:sequence>
				<xs:element minOccurs="1" maxOccurs="unbounded" ref="circuito" />
			</xs:sequence>
		</xs:complexType>
	</xs:element>
	<xs:element name="circuito">
		<xs:complexType>
			<xs:sequence>
				<xs:element ref="referencias" />
				<xs:element ref="imagenes" />
				<xs:element ref="videos" />
				<xs:element ref="coordenada" />
				<xs:element ref="tramos" />
			</xs:sequence>
			<xs:attribute name="nombre" type="xs:ID" use="required" />
			<xs:attribute name="longitud" type="xs:double" use="required" />
			<xs:attribute name="anchura" type="xs:double" use="required" />
			<xs:attribute name="fecha2024" type="xs:date" use="required" />
			<xs:attribute name="horaes" type="xs:string" use="required" />
			<xs:attribute name="nvueltas" type="xs:float" use="required" />
			<xs:attribute name="localidad" type="xs:string" use="required" />
			<xs:attribute name="pais" type="xs:string" use="required" />
		</xs:complexType>
	</xs:element>
	<xs:element name="referencias">
		<xs:complexType>
			<xs:sequence>
				<xs:element minOccurs="3" maxOccurs="unbounded" ref="referencia" />
			</xs:sequence>
		</xs:complexType>
	</xs:element>
	<xs:element name="referencia">
		<xs:complexType>
			<xs:simpleContent>
				<xs:extension base="xs:string">
					<xs:attribute name="ref" type="xs:string" use="required" />
				</xs:extension>
			</xs:simpleContent>
		</xs:complexType>
	</xs:element>
	<xs:element name="imagenes">
		<xs:complexType>
			<xs:sequence>
				<xs:element minOccurs="1" maxOccurs="5" ref="imagen" />
			</xs:sequence>
		</xs:complexType>
	</xs:element>
	<xs:element name="imagen">
		<xs:complexType>
			<xs:attribute name="foto" type="xs:string" use="required" />
		</xs:complexType>
	</xs:element>
	<xs:element name="videos">
		<xs:complexType>
			<xs:sequence>
				<xs:element minOccurs="0" maxOccurs="3" ref="video" />
			</xs:sequence>
		</xs:complexType>
	</xs:element>
	<xs:element name="video">
		<xs:complexType>
			<xs:attribute name="titulo" type="xs:string" use="required" />
		</xs:complexType>
	</xs:element>
	<xs:element name="coordenada">
		<xs:complexType>
			<xs:attribute name="longitud" type="xs:float" use="required" />
			<xs:attribute name="altitud" type="xs:float" use="required" />
			<xs:attribute name="latitud" type="xs:float" use="required" />
		</xs:complexType>
	</xs:element>
	<xs:element name="tramos">
		<xs:complexType>
			<xs:sequence>
				<xs:element minOccurs="1" maxOccurs="unbounded" ref="tramo" />
			</xs:sequence>
		</xs:complexType>
	</xs:element>
	<xs:element name="tramo">
		<xs:complexType>
			<xs:sequence>
				<xs:element ref="coordenada" />
			</xs:sequence>
			<xs:attribute name="distancia" type="xs:string" use="required" />
			<xs:attribute name="numerotramo" type="xs:string" use="required" />
		</xs:complexType>
	</xs:element>
</xs:schema>